{
  "schemaVersion": "2.0",
  "currency": "CNY",
  "amountUnit": "CNY_10K",
  "procurement": {
    "unitPrice": 1390,
    "quantity": 128,
    "advanceRate": 30,
    "guaranteeRate": 35,
    "guaranteeNode": 1,
    "advanceNode": 3,
    "balanceNode": 5,
    "guaranteeBasePrice": 1390,
    "guaranteeBaseMode": "follow"
  },
  "guaranteeAllocation": "quantity",
  "intermediaries": [
    {
      "name": "居间 A",
      "rebatePerUnit": 85
    }
  ],
  "customers": [
    {
      "name": "下游 A",
      "unitPrice": 1500,
      "quantity": 128,
      "advanceRate": 29.4,
      "advanceNode": 2,
      "balanceNode": 4,
      "advanceMode": "auto"
    }
  ],
  "advanceMarginPoints": 3
}
